{
  "$schema": "../_shared/schemas/exploration.schema.json",
  "metadata": {
    "skill_name": "skill-architect",
    "version": "2.0.0",
    "created_at": "2026-05-27T02:15:00Z",
    "lifecycle_status": "raw"
  },
  "problem_statement": {
    "summary": "Nâng cấp meta-skill thiết kế 'skill-architect' lên tiêu chuẩn Clean & Solid Ver_2.0.0, chuyển hóa đầu ra từ Markdown phẳng (design.md) sang Sổ cái JSON có cấu trúc (blueprint.json) nhằm tự động hóa 100% và triệt tiêu tính mơ hồ.",
    "context": "Trong kiến trúc cũ Ver_0, đầu ra của Architect là design.md phẳng chứa các đoạn text tự do, khiến AI ở các Stage Planner và Builder hạ nguồn dễ bị nhầm lẫn, mất dấu trace tag hoặc hallucinate tên file vật lý. Phiên bản 2.0.0 chuẩn hóa đầu ra thành blueprint.json được xác thực nghiêm ngặt bằng schema.",
    "target_audience": "Hybrid (Human & AI)"
  },
  "technical_risks": [
    {
      "risk_name": "Blueprint Schema Violation",
      "severity": "high",
      "description": "Architect sinh ra tệp blueprint.json bị sai cấu trúc cú pháp JSON hoặc thiếu các trường bắt buộc như static_structure, dynamic_behavior, hay mitigation_map.",
      "mitigation_strategy": "Tích hợp validator chạy tự động schema_validator.py đối chiếu với blueprint.schema.json ngay tại đầu ra của Stage 1."
    },
    {
      "risk_name": "Static File Path Hallucination",
      "severity": "medium",
      "description": "Architect tự ý đề xuất các file ảo, file placeholder (ví dụ: temp.py, script.sh) hoặc phân vùng sai 7 Zones quy định.",
      "mitigation_strategy": "Ràng buộc cứng trong workflow.md và guardrails.md yêu cầu Architect chỉ định chính xác tên file vật lý thực tế và ánh xạ 100% vào enum 7 Zones."
    },
    {
      "risk_name": "Circular Dependency in Execution Flows",
      "severity": "medium",
      "description": "Thiết kế các steps trong sequence logic của dynamic_behavior bị vòng lặp phụ thuộc chéo dẫn đến deadlock khi Planner phân rã công việc.",
      "mitigation_strategy": "Quy định cấu trúc steps tuyến tính nghiêm ngặt, mỗi step có actor và expected_result đơn trị rõ ràng."
    }
  ],
  "security_risks": [
    {
      "threat_type": "Prompt Injection",
      "attack_vector": "Dữ liệu đầu vào trong exploration.json (như problem_statement) bị cài cắm prompt tấn công độc hại từ bên ngoài hòng bẻ cong hành vi thiết kế của Architect.",
      "potential_impact": "Architect sinh ra blueprint.json độc hại, phá hủy cấu trúc 7 Zones, cài cắm backdoor vào static_structure.",
      "defense_mechanism": "Sử dụng strict XML boundaries (<external_input>) để bọc toàn bộ dữ liệu thô đọc được, thiết lập Directive Separation trong prompt hệ thống."
    }
  ],
  "dependencies": [
    {
      "name": "blueprint-schema",
      "version_constraint": "^2.0.0",
      "type": "other"
    },
    {
      "name": "schema-validator",
      "version_constraint": "^1.0.0",
      "type": "system_tool"
    }
  ],
  "decomposed": false,
  "micro_skills": []
}