{
  "$schema": "file:///home/stveve/Documents/workspace/deep_work_by_steve/skills/Update-suite/updated-suite/_shared/schemas/exploration.schema.json",
  "metadata": {
    "skill_name": "skill-explorer",
    "version": "2.0.0",
    "created_at": "2026-05-27T01:50:00Z",
    "lifecycle_status": "designed"
  },
  "problem_statement": {
    "summary": "Nâng cấp skill-explorer để khởi tạo bối cảnh khảo sát nghiệp vụ Stage 0 và quản lý Sổ cái JSON có cấu trúc.",
    "context": "Trong Master Skill Suite Ver_2.0.0, việc truyền nhận dữ liệu giữa các Stage bắt buộc phải sử dụng Sổ cái JSON có cấu trúc (exploration.json, criteria.json) thay thế cho Markdown phẳng nhằm đạt tỷ lệ parse chính xác 100% của AI và triệt tiêu tính mơ hồ.",
    "target_audience": "Hybrid (Human & AI)"
  },
  "technical_risks": [
    {
      "risk_name": "JSON Parsing and Validation Failures",
      "severity": "high",
      "description": "Các tệp JSON được tạo ra có thể sai cú pháp hoặc không khớp schema do AI tạo cấu trúc không chuẩn.",
      "mitigation_strategy": "Tích hợp thư viện jsonschema/pyyaml trong scripts/init_context.py để tự động validate ngay khi tạo file."
    },
    {
      "risk_name": "L0 Anchor Token Budget Overrun",
      "severity": "medium",
      "description": "SKILL.md có thể phình to quá 700 tokens do chứa quá nhiều chi tiết nghiệp vụ.",
      "mitigation_strategy": "Triển khai chính sách Progressive Disclosure nghiêm ngặt, chia nhỏ các chi tiết sang policy/ và knowledge/."
    },
    {
      "risk_name": "Smart Context Splitter Data Loss",
      "severity": "high",
      "description": "Khi phân rã Micro-skills, việc kế thừa và copy tài nguyên resources/ thô có thể bị thiếu sót hoặc đè dữ liệu.",
      "mitigation_strategy": "Xây dựng cơ chế sao chép an toàn (atomic copy) và tự động tạo design.md chuẩn hóa cho từng micro-skill con."
    }
  ],
  "security_risks": [
    {
      "threat_type": "Prompt Injection",
      "attack_vector": "AI đọc và phân tích các tài liệu nghiệp vụ hoặc mã nguồn thô chứa mã độc prompt injection từ bên ngoài.",
      "potential_impact": "Phá vỡ ranh giới bảo mật, ép buộc AI thực thi các lệnh hệ thống nguy hiểm thông qua run_command.",
      "defense_mechanism": "Áp dụng bắt buộc các thẻ XML bọc dữ liệu thô (<external_input>) và cấm tuyệt đối việc thực thi mã nguồn lạ bên ngoài sandbox cô lập."
    }
  ],
  "dependencies": [
    {
      "name": "python",
      "type": "system_tool",
      "version_constraint": ">=3.10"
    },
    {
      "name": "pyyaml",
      "type": "python_library",
      "version_constraint": ">=6.0"
    }
  ],
  "decomposed": false,
  "micro_skills": []
}
